description, isdog, url
This photo was submitted to Your Shot, our photo community on Instagram. Follow us on Instagram at @natgeoyourshot or visit us at natgeo.com/yourshot for the latest submissions and news about the community., 1, https://i.natgeofe.com/n/284ba48a-3801-4e63-ad95-69a4d2043aad/6994062.jpg?w=636&h=358
This photo was submitted to Your Shot, our photo community on Instagram. Follow us on Instagram at @natgeoyourshot or visit us at natgeo.com/yourshot for the latest submissions and news about the community., 1, https://i.natgeofe.com/n/f1704a84-cca9-432c-b04c-e663f4034ab4/7087605.jpg?w=636&h=480
Actors Patrick Fugit and Kate Hudson in a scene from 'Almost Famous.', 0, https://static.stacker.com/s3fs-public/styles/sar_screen_maximum_large/s3/2023-04/almost-famous.jpeg
hi-res b&w photo of Mars surface with visible part part of rover, 0, https://i.natgeofe.com/n/2d4fb8cb-4e10-4f80-ac60-71ac10baf096/mars-rover-cameras-viking.jpg?w=1024&h=364
man in space suit sitting on send., 0, https://i.natgeofe.com/n/b587be07-9308-4059-9797-c206200fd631/mars-rover-cameras-matt-damon.jpg?w=636&h=424
silver rocket vertical on the ground under blue sky., 0, https://i.natgeofe.com/n/008aed8a-099d-4933-ba6c-11d00d3cca3c/mars-rover-cameras-spacex.jpg?w=1024&h=683
How these 1930s maps left some neighborhoods with fewer trees, 0, https://i.natgeofe.com/n/f0a5c543-17ef-4207-847c-e22d722ebc65/0000017a-1012-d79e-a37f-b8d3ad660000.jpg?w=300&h=169
Why a whale's world is a world of sound, 0, https://i.natgeofe.com/n/1f7aca48-f191-40cc-a5f3-9f5ff1c51135/00000178-d1f2-defe-a57a-f1f38ac60000.jpg?w=300&h=169
Behind the Scenes of Our January 2021 Special Issue, ‘2020: The Year in Pictures’, 0, https://i.natgeofe.com/n/333a07ba-ddf9-456c-ac19-e616f0724ab6/00000176-6cde-dee3-a97f-fdfedbc00000.jpg?w=300&h=533
The Making of a Photograph: Commitment March, 0, https://i.natgeofe.com/n/5238e892-03f8-473f-902e-a9ca339efc4a/00000176-546b-dee3-a97f-f5ff8c510000.jpg?w=300&h=169
Tales of the Giant, 1, https://i.natgeofe.com/n/c7fe6a88-e5f3-4d4e-89fe-94da42e91592/00000176-1942-d6fe-a17f-fdefe60b0000.jpg?w=300&h=533
Actor Sean Astin as the title character of the college football movie 'Rudy.', 0, https://static.stacker.com/s3fs-public/styles/sar_screen_maximum_large/s3/2023-04/sean-astin-rudy.jpg
Discover how conservationists are reintroducing extinct wildlife in Iberá National Park, 0, https://i.natgeofe.com/n/ae3a79ba-f0bc-4287-9f68-22eb1e97e8ec/00000171-a4e0-da64-affd-ece78ca30000.jpg?w=300&h=169
old painting depicting man in armor and naked woman., 0, https://i.natgeofe.com/n/1a0231fd-ac31-41b2-b89f-a12389fca5cd/mars-rover-cameras-painting.jpg?w=636&h=817
longleged creature working over river and shooting guns., 0, https://i.natgeofe.com/n/f4796f4e-90c2-4cf5-9a40-d91412df02fb/mars-rover-cameras-thriller.jpg?w=636&h=792
planet surface marked with lines and names., 0, https://i.natgeofe.com/n/c172b617-47b3-49f5-8793-10aa4f7e6055/nationalgeographic_933129.jpg?w=636&h=760
movie poster with insect-like creature flyings toward Earth., 0, https://i.natgeofe.com/n/bb6c15c3-0900-44ad-98a6-0286472c41f8/mars-rover-cameras-trip-to-mars.jpg?w=636&h=851
tall preacher shaking hands with human., 0, https://i.natgeofe.com/n/0fa355b6-2da0-4f21-ab14-0c5f24305e96/mars-rover-cameras-fantastic-adventures.jpg?w=636&h=847
movie poster., 0, https://i.natgeofe.com/n/a0a94313-9a44-41af-ae0e-e1f3d57b7eac/mars-rover-cameras-sci-fi-drama.jpg?w=636&h=1198
blurry photo in reddish color with dark spots., 0, https://i.natgeofe.com/n/bf0bb338-e2e3-4c10-a132-fedd08f1662b/1954_mars_slipher.jpg?w=636&h=643
Actors Mariska Hargitay and Christopher Meloni filming on location for 'Law & Order: SVU' on the streets of Manhattan on Feb. 14, 2011 in New York City., 0, https://static.stacker.com/s3fs-public/styles/sar_screen_maximum_large/s3/2023-04/law-and-order-svu_0.jpg
b&W blurry photo of planet surface., 0, https://i.natgeofe.com/n/921d43e4-d71a-4291-bf2a-055343a6d56b/mars-rover-cameras-blurry-photo-surface.jpg?w=636&h=582
painting of vegetation on Mars., 0, https://i.natgeofe.com/n/df1c8bab-a96e-4a18-844e-89bd30cb470b/mars-rover-cameras-martians-plants.jpg?w=1024&h=701
hi-res b&w photo of Mars surface with visible part part of rover, 0, https://i.natgeofe.com/n/2d4fb8cb-4e10-4f80-ac60-71ac10baf096/mars-rover-cameras-viking.jpg?w=1024&h=364
man in space suit sitting on send., 0, https://i.natgeofe.com/n/b587be07-9308-4059-9797-c206200fd631/mars-rover-cameras-matt-damon.jpg?w=636&h=424
silver rocket vertical on the ground under blue sky., 0, https://i.natgeofe.com/n/008aed8a-099d-4933-ba6c-11d00d3cca3c/mars-rover-cameras-spacex.jpg?w=1024&h=683
How these 1930s maps left some neighborhoods with fewer trees, 0, https://i.natgeofe.com/n/f0a5c543-17ef-4207-847c-e22d722ebc65/0000017a-1012-d79e-a37f-b8d3ad660000.jpg?w=300&h=169
Actors Patrick Fugit and Kate Hudson in a scene from 'Almost Famous.', 0, https://static.stacker.com/s3fs-public/styles/sar_screen_maximum_large/s3/2023-04/almost-famous.jpeg
Why a whale's world is a world of sound, 0, https://i.natgeofe.com/n/1f7aca48-f191-40cc-a5f3-9f5ff1c51135/00000178-d1f2-defe-a57a-f1f38ac60000.jpg?w=300&h=169
Behind the Scenes of Our January 2021 Special Issue, ‘2020: The Year in Pictures’, 0, https://i.natgeofe.com/n/333a07ba-ddf9-456c-ac19-e616f0724ab6/00000176-6cde-dee3-a97f-fdfedbc00000.jpg?w=300&h=533
The Making of a Photograph: Commitment March, 0, https://i.natgeofe.com/n/5238e892-03f8-473f-902e-a9ca339efc4a/00000176-546b-dee3-a97f-f5ff8c510000.jpg?w=300&h=169
Tales of the Giant, 1, https://i.natgeofe.com/n/c7fe6a88-e5f3-4d4e-89fe-94da42e91592/00000176-1942-d6fe-a17f-fdefe60b0000.jpg?w=300&h=533
Discover how conservationists are reintroducing extinct wildlife in Iberá National Park, 0, https://i.natgeofe.com/n/ae3a79ba-f0bc-4287-9f68-22eb1e97e8ec/00000171-a4e0-da64-affd-ece78ca30000.jpg?w=300&h=169
Actor Sean Astin as the title character of the college football movie 'Rudy.', 0, https://static.stacker.com/s3fs-public/styles/sar_screen_maximum_large/s3/2023-04/sean-astin-rudy.jpg
A baby elephant drinks milk from a bottle held in its trunk while a man helps feed another elephant, 0, https://www.nationalgeographic.com/content/dam/expeditions/Homepage/April-2023/kenya-trip-1000x666.adapt.536.1.jpg
A group of travelers pose for a photo, holding a flag with the words ‘National Geographic Society’, 0, https://www.nationalgeographic.com/content/dam/expeditions/Homepage/April-2023/past-guest-offer-1000x666.adapt.536.1.jpg
Two women and a young girl walk through a grassy field wearing waterproof hiking jackets, 0, https://www.nationalgeographic.com/content/dam/expeditions/Homepage/April-2023/alaska-family-offer-hero-image-ak481-1000x666.adapt.536.1.jpg
This photo was submitted to Your Shot, our photo community on Instagram. Follow us on Instagram at @natgeoyourshot or visit us at natgeo.com/yourshot for the latest submissions and news about the community., 1, https://i.natgeofe.com/n/fe570446-fde8-41e6-a837-1b649f4315d4/6736225.jpg?w=636&h=954
Dealer Resources, 0, https://images.natgeomaps.com/PROD_SM_250px/DYH0000125_1_SM.jpg
Dealer form, 0, https://images.natgeomaps.com/Dealer_Link/Icon_NewDealer.jpg
The labradoodle originated in a request from a blind woman in Hawaii, who needed a guide dog that wouldn’t inflame her husband’s allergies., 1, https://i.guim.co.uk/img/media/5ef1cd89841af6b05d9d59617d622adce3e6cd86/0_229_4928_2957/master/4928.jpg?width=465&quality=85&dpr=1&s=none
Yosemite National Park Map, 0, https://images.natgeomaps.com/PROD_SM_250px/TI00000206_0_SM.jpg
World Executive Map [Poster Size], 0, https://images.natgeomaps.com/PROD_SM_250px/RE01020374_1_SM.jpg
Grand Canyon, North and South Rims Map [Grand Canyon National Park], 0, https://images.natgeomaps.com/PROD_SM_250px/TI00000261_0_SM.jpg
A labrador retriever wearing an electric dog collar, 1, https://i.guim.co.uk/img/media/bc74ed32d95a60ec995bbb3270d7dfd2e538ea41/0_146_5400_3240/master/5400.jpg?width=460&quality=85&auto=format&fit=max&s=4bdd1ed2f1a264f37818cb1c300ad63a
Olympic National Park Map, 0, https://images.natgeomaps.com/PROD_SM_250px/TI00000216_0_SM.jpg
Glacier and Waterton Lakes National Parks Map, 0, https://images.natgeomaps.com/PROD_SM_250px/TI00000215_0_SM.jpg
Yellowstone National Park Map, 0, https://images.natgeomaps.com/PROD_SM_250px/TI00000201_0_SM.jpg
Grand Teton National Park Map, 0, https://images.natgeomaps.com/PROD_SM_250px/TI00000202_0_SM.jpg
Great Smoky Mountains National Park Map, 0, https://images.natgeomaps.com/PROD_SM_250px/TI00000229_0_SM.jpg
Rocky Mountain National Park Map, 0, https://images.natgeomaps.com/PROD_SM_250px/TI00000200_0_SM.jpg
Zion National Park Map, 0, https://images.natgeomaps.com/PROD_SM_250px/TI00000214_0_SM.jpg
Yosemite National Park Map, 0, https://images.natgeomaps.com/PROD_SM_250px/TI00000206_0_SM.jpg
World Executive Map [Poster Size], 0, https://images.natgeomaps.com/PROD_SM_250px/RE01020374_1_SM.jpg
Grand Canyon, North and South Rims Map [Grand Canyon National Park], 0, https://images.natgeomaps.com/PROD_SM_250px/TI00000261_0_SM.jpg
alfred-ng, 0, https://www.cnet.com/a/img/resize/9f7f93e29053e422476f5614aefb3ce8d8acf076/hub/2019/04/15/eda77117-0a05-49d4-90a2-e32a33129737/alfred-ng.jpg?auto=webp&fit=crop&height=96&width=96
Olympic National Park Map, 0, https://images.natgeomaps.com/PROD_SM_250px/TI00000216_0_SM.jpg
Glacier and Waterton Lakes National Parks Map, 0, https://images.natgeomaps.com/PROD_SM_250px/TI00000215_0_SM.jpg
Yellowstone National Park Map, 0, https://images.natgeomaps.com/PROD_SM_250px/TI00000201_0_SM.jpg
Grand Teton National Park Map, 0, https://images.natgeomaps.com/PROD_SM_250px/TI00000202_0_SM.jpg
Great Smoky Mountains National Park Map, 0, https://images.natgeomaps.com/PROD_SM_250px/TI00000229_0_SM.jpg
Rocky Mountain National Park Map, 0, https://images.natgeomaps.com/PROD_SM_250px/TI00000200_0_SM.jpg
Zion National Park Map, 0, https://images.natgeomaps.com/PROD_SM_250px/TI00000214_0_SM.jpg
Prague Map, 0, https://images.natgeomaps.com/PROD_SM_250px/DC01020353_0_SM.jpg
New York Map, 0, https://images.natgeomaps.com/PROD_SM_250px/GM01020483_0_SM.jpg
United States, California and Nevada Map, 0, https://images.natgeomaps.com/PROD_SM_250px/AD00003119_0_SM.jpg
alfred-ng, 0, https://www.cnet.com/a/img/resize/da4f4fc158bb15f638bb0394f12667f8ab2a8114/hub/2019/04/15/eda77117-0a05-49d4-90a2-e32a33129737/alfred-ng.jpg?auto=webp&fit=crop&height=84&width=84
Delmarva Peninsula Map, 0, https://images.natgeomaps.com/PROD_SM_250px/TI00000772_0_SM.jpg
United States, Southeast Map, 0, https://images.natgeomaps.com/PROD_SM_250px/AD00003126_0_SM.jpg
United States Executive Map [Enlarged], 0, https://images.natgeomaps.com/PROD_SM_250px/RE00620115_1_SM.jpg
Road Atlas 2023: Scenic Drives Edition [United States, Canada, Mexico], 0, https://images.natgeomaps.com/PROD_SM_250px/RD00620165_0_SM.jpg
World with Flags & Facts Map [folded], 0, https://images.natgeomaps.com/PROD_SM_250px/RE01021208_0_SM.jpg
Kremmling, Granby Map, 0, https://images.natgeomaps.com/PROD_SM_250px/TI00000106_0_SM.jpg
National Parks of the United States Map, 0, https://images.natgeomaps.com/PROD_SM_250px/DM01021205_0_SM.jpg
Prague Map, 0, https://images.natgeomaps.com/PROD_SM_250px/DC01020353_0_SM.jpg
New York Map, 0, https://images.natgeomaps.com/PROD_SM_250px/GM01020483_0_SM.jpg
United States, California and Nevada Map, 0, https://images.natgeomaps.com/PROD_SM_250px/AD00003119_0_SM.jpg
k-9-selma-portrait, 1, https://www.cnet.com/a/img/resize/f267ecd4d3e0f0d4958b7182e5b6a11687fbf6b0/hub/2018/06/06/1c61f50f-a79b-4d9e-ad84-6fba30919ef3/k-9-selma-portrait.jpg?auto=webp&fit=crop&height=675&width=1200
Delmarva Peninsula Map, 0, https://images.natgeomaps.com/PROD_SM_250px/TI00000772_0_SM.jpg
United States, Southeast Map, 0, https://images.natgeomaps.com/PROD_SM_250px/AD00003126_0_SM.jpg
United States Executive Map [Enlarged], 0, https://images.natgeomaps.com/PROD_SM_250px/RE00620115_1_SM.jpg
Road Atlas 2023: Scenic Drives Edition [United States, Canada, Mexico], 0, https://images.natgeomaps.com/PROD_SM_250px/RD00620165_0_SM.jpg
World with Flags & Facts Map [folded], 0, https://images.natgeomaps.com/PROD_SM_250px/RE01021208_0_SM.jpg
Kremmling, Granby Map, 0, https://images.natgeomaps.com/PROD_SM_250px/TI00000106_0_SM.jpg
National Parks of the United States Map, 0, https://images.natgeomaps.com/PROD_SM_250px/DM01021205_0_SM.jpg
Map reader, 0, https://www.natgeomaps.com/pub/media/wysiwyg/blog/IIMG_3873-2000_1.jpeg
Wind River Range map, 0, https://www.natgeomaps.com/pub/media/wysiwyg/mapping.png
This photo was submitted to Your Shot, our photo community on Instagram. Follow us on Instagram at @natgeoyourshot or visit us at natgeo.com/yourshot for the latest submissions and news about the community., 1, https://i.natgeofe.com/n/6bfc1485-01aa-4a8a-bec0-bbbc6cf1e693/7033492.jpg?w=636&h=424
Background image of National Geographic, 0, https://cdn-ssl.s7.disneystore.com/is/image/ShopDisney/mb_boy_natgeo_20230403?fit=constrain&cropN=0,0,1,1&fmt=jpeg&qlt=90&wid=1200
National Geographic Elephant Plush – 10'', 0, https://cdn-ssl.s7.disneystore.com/is/image/DisneyShopping/1516105803730?fmt=jpeg&qlt=90&wid=192&hei=192
National Geographic Elephant Plush – 10'', 0, https://cdn-ssl.s7.disneystore.com/is/image/DisneyShopping/1516105803730-1?fmt=jpeg&qlt=90&wid=192&hei=192
National Geographic Elephant Plush – 10'', 0, https://cdn-ssl.s7.disneystore.com/is/image/DisneyShopping/1516105803730-4?fmt=jpeg&qlt=90&wid=192&hei=192
National Geographic Elephant Tote Bag, 0, https://cdn-ssl.s7.disneystore.com/is/image/DisneyShopping/4203056585823?fmt=jpeg&qlt=90&wid=192&hei=192
National Geographic Elephant Tote Bag, 0, https://cdn-ssl.s7.disneystore.com/is/image/DisneyShopping/4203056585823-1?fmt=jpeg&qlt=90&wid=192&hei=192
National Geographic Elephant Pin – Limited Release, 0, https://cdn-ssl.s7.disneystore.com/is/image/DisneyShopping/3801056527650?fmt=jpeg&qlt=90&wid=192&hei=192
National Geographic Elephant Pin – Limited Release, 0, https://cdn-ssl.s7.disneystore.com/is/image/DisneyShopping/3801056527650-1?fmt=jpeg&qlt=90&wid=192&hei=192
Give the gift of everyday exploration with a subscription to National Geographic. Gift Now, 0, https://cdn-ssl.s7.disneystore.com/is/image/ShopDisney/NGM-9474-Disruptor-Tile-1150x810?fit=constrain&cropN=0,0,1,1&fmt=jpeg&qlt=90&wid=480
National Geographic Elephants Striped T-Shirt for Adults, 0, https://cdn-ssl.s7.disneystore.com/is/image/DisneyShopping/5205059588729?fmt=jpeg&qlt=90&wid=192&hei=192
a dog sitting among short green pine trees, 0, https://i.natgeofe.com/n/c90a67ea-4c7a-4e2e-b2ee-f77045577d10/mm9250_201011_004729_2x3.jpg?w=374&h=561
National Geographic, 0, https://ngmdomsubs.nationalgeographic.com/pubs/NG/images/eCare/img/ngmcover.jpg
Nat Geo Traveler, 0, https://ngmdomsubs.nationalgeographic.com/pubs/NG/images/eCare/img/ngmtravlercover.jpg
a dog with its head hidden behind a bush and the sun rising behind it, 1, https://i.natgeofe.com/n/5e37baa5-a3d7-40a2-97b1-4e31740a1b6f/mm9250_201002_000444.jpg?w=1024&h=683
Nat Geo History, 0, https://ngmdomsubs.nationalgeographic.com/pubs/NG/images/eCare/img/ngmhistorycover.jpg
Nat Geo Kids, 0, https://ngmdomsubs.nationalgeographic.com/pubs/NG/images/eCare/img/ngmkidscover.jpg
Nat Geo Little Kids, 0, https://ngmdomsubs.nationalgeographic.com/pubs/NG/images/eCare/img/ngmlittlekidscover.jpg
Be you. Be here. Be part of the story., 0, https://tbcdn.talentbrew.com/company/391/v3_0/img/banner-be-you.jpg
Animals, 0, https://i.natgeofe.com/n/af840d08-90d2-4d46-8b18-d1cbc39f08ab/family_16x9.jpg?w=767&h=431
the back of a dog with dust being churned up around it, 0, https://i.natgeofe.com/n/a3cceecf-cedf-4b58-b592-04603dd76f21/mm9250_201003_001634.jpg?w=1024&h=683
Environment, 0, https://i.natgeofe.com/n/dbdf65d0-f913-4456-bad1-a8eacafc39ee/NGM-8522-Enviro-2.jpg?w=767&h=431
Family, 1, https://i.natgeofe.com/n/230e7369-58ac-404b-a5a2-73c6c2a887de/nationalgeographic_1740210_16x9.jpg?w=767&h=431
Health, 0, https://i.natgeofe.com/n/c0151f10-2e88-4aec-9181-bb646b0bc623/NGM-8522._Health-V2.jpg?w=767&h=431
History, 0, https://i.natgeofe.com/n/bd0ca794-0597-4cc1-b1bb-e2ac4ea9793d/nationalgeographic_631501_16x9.jpg?w=767&h=431
Photography, 0, https://i.natgeofe.com/n/fe4c402e-5c20-4932-80d2-3876bdad7abf/culture_16x9.jpg?w=767&h=431
Science, 0, https://i.natgeofe.com/n/43767514-e029-4629-af4d-21efa6f72b8b/science_16x9.jpg?w=767&h=431
The Compass, 0, https://i.natgeofe.com/n/2231278b-4a8c-429b-9c8f-3abb4f667eff/compass_nlsignup-1_16x9.jpg?w=767&h=431
Travel, 0, https://i.natgeofe.com/n/8894768c-fa3d-4f9f-95b5-9b43e5ce58c8/9927286_uploadsmember1469524yourshot-1469524-9927286jpg_7r3uw3et4gsdw44eyr3qrhtow7p3eflutfvvbpyjwjhzlmh4iziq_1900x1267_16x9.jpg?w=767&h=431
a dog sniffing at a training device, 1, https://i.natgeofe.com/n/746dc410-c8e3-4a71-a77c-15636a453595/mm9250_201013_005857.jpg?w=636&h=424
a dog in red boots outside of a car at dusk, 1, https://i.natgeofe.com/n/d00188e2-88aa-4a77-a10e-192e9d9a22b1/mm9250_201002_000002.jpg?w=1024&h=683
a dog with their paws in the hands of a woman, 1, https://i.natgeofe.com/n/c54b308c-a3de-4eff-9192-27fc392c2a66/mm9250_201003_003163.jpg?w=636&h=424
This photo was submitted to Your Shot, our photo community on Instagram. Follow us on Instagram at @natgeoyourshot or visit us at natgeo.com/yourshot for the latest submissions and news about the community., 1, https://i.natgeofe.com/n/440d8f96-b385-4962-af65-a0f34ac87749/7051839.jpg?w=636&h=424
a dog sitting and looking at a ball being held by a person, 1, https://i.natgeofe.com/n/05d6152e-1a2a-41f1-ae8d-14e57c2d662e/mm9250_201003_002979.jpg?w=1024&h=683
a woman washing a dog with a hose, 1, https://i.natgeofe.com/n/eef43552-eac8-46d6-951b-f22d779a3cc0/mm9250_201003_002192.jpg?w=636&h=424
two people walking behind a dog in a large field, 0, https://i.natgeofe.com/n/c62020f6-1390-426c-8411-f5b476be166b/mm9250_201011_004936.jpg?w=1024&h=683
a dog and a woman climbing over a fallen tree, 1, https://i.natgeofe.com/n/9e438c80-23ff-4a9d-b5d4-ef6cbe14427d/mm9250_201011_005341.jpg?w=636&h=424
a dog running through a field on a misty day, 0, https://i.natgeofe.com/n/a6706b46-fee7-4c79-8b5f-ad596bec31e2/mm9250_201011_005097.jpg?w=1024&h=683
K9 Search and Rescue Specialists Inc. cadaver dog, Chance, searching for a body in Tuscaloosa, Alabama., 1, https://i.natgeofe.com/n/0984ef3e-48c0-4386-b86d-b7178aefce46/73012.jpg?w=374&h=246
This photo was submitted to Your Shot, our photo community on Instagram. Follow us on Instagram at @natgeoyourshot or visit us at natgeo.com/yourshot for the latest submissions and news about the community., 0, https://i.natgeofe.com/n/b2388e61-e4f2-46f9-befd-a130909cd52b/6940231.jpg?w=636&h=426
an Marine with his dog, 1, https://i.natgeofe.com/n/f8fad843-6c2c-45e7-befb-1f8a84c54b9c/MM8119_120514_06568.jpg?w=374&h=249
a Marine with his dog, 1, https://i.natgeofe.com/n/9d8a92ff-dae4-4fc4-bf33-8cbace0ebb93/MM8119_130418_33476.jpg?w=636&h=424
a Navy Master-At-Arms with his dog, 1, https://i.natgeofe.com/n/b46d9287-6969-4aaa-b6bb-724c35f66722/MM8119_120518_11041.jpg?w=636&h=424
trainers at K2 Solutions training a dog to work with military and law enforcement units, 1, https://i.natgeofe.com/n/ceaeea5e-ccb8-4c9e-a7f2-607442311624/MM8119_130417_31983.jpg?w=636&h=424
an Air Force staff sergeant with her dog, 1, https://i.natgeofe.com/n/071f6e85-3251-4158-bb6b-8eb55b4ae514/MM8119_121015_25171.jpg?w=636&h=424
Air Force senior airman and his dog, 1, https://i.natgeofe.com/n/803fd778-60a5-4cb7-ae16-e3626307b657/MM8119_121017_26636.jpg?w=636&h=424
Army Staff Sgt. Terry Young and his German shepherd in Afghanistan, 1, https://i.natgeofe.com/n/66252e4d-b50a-44b0-8904-bee157f7d57d/MM8119_121003_19745.jpg?w=636&h=424
Eliana and Jose Armenta relaxing with their dogs, 1, https://i.natgeofe.com/n/df24cbc1-6a68-499b-a2b9-cfd1b8bb4f68/MM8119_130421_36290.jpg?w=636&h=424
Seven-week-old Belgian Malinois puppies exercise at Lackland Air Force Base months before their training starts., 1, https://i.natgeofe.com/n/2b994316-7948-4f0f-afe7-b66fc07f055a/MM8119_130429_43422.jpg?w=636&h=424
A Belgian Malinois learns obedience skills as it trains on an obstacle course at Lackland., 1, https://i.natgeofe.com/n/ac59df4b-5f4a-4b86-820e-fbfe5efde4ed/MM8119_130429_44045.jpg?w=636&h=424
This photo was submitted to Your Shot, our photo community on Instagram. Follow us on Instagram at @natgeoyourshot or visit us at natgeo.com/yourshot for the latest submissions and news about the community., 1, https://i.natgeofe.com/n/61f9946b-2e7a-4805-8e0a-e49d19843243/7016511.jpg?w=636&h=424
Handlers in training use an ammunition can as a dog stand-in to learn leash skills and hand signals at Lackland., 0, https://i.natgeofe.com/n/543272bb-97c9-4246-89a4-d9282ef4c6e3/MM8119_120523_12345.jpg?w=636&h=424
Lucky, a German shepherd, practices searching for explosives with his handler at Yuma Proving Ground in Arizona., 1, https://i.natgeofe.com/n/214f75b8-182c-4862-b8bd-f369c6d8c5f3/MM8119_120508_03034.jpg?w=636&h=424
How to carry a wounded dog? A Belgian Malinois named Dino and his handler practice at Yuma., 1, https://i.natgeofe.com/n/2595b278-0428-4889-81b3-bd5e00db946d/MM8119_120510_04897.jpg?w=636&h=424
At Yuma, Marine Gunnery Sgt. Kristopher Knight conditions Ronnie to remain calm at the sound of gunfire., 1, https://i.natgeofe.com/n/a20cb1b3-fdb7-4632-9a89-260877735010/MM8119_120511_05648.jpg?w=636&h=424
an Air Force dog handler and his dog on a helicopter transport in Afghanistan, 0, https://i.natgeofe.com/n/2bf285c4-c4d1-4bcd-a351-299cac21cbf3/MM8119_121005_20386.jpg?w=636&h=424
Army Staff Sgt. Jason Cartwright bonding with his Labrador retriever, 1, https://i.natgeofe.com/n/027996e7-3b68-45a9-8800-366bd0cdcb20/MM8119_121008_21696.jpg?w=1024&h=683
an Air Force dog handler clipping his dog's nails, 1, https://i.natgeofe.com/n/c05757c8-2934-4f52-b1ae-194a4b1cb226/MM8119_121006_20502.jpg?w=1024&h=683
a Labrador retriever sniffing for weapons and explosives in a basement in Kandahar, 1, https://i.natgeofe.com/n/2e75d9ff-aad0-425b-b50b-d5ad3c664b68/MM8119_121016_25537.jpg?w=636&h=424
an Army veterinarian awaiting arrival of an injured military working dog, 1, https://i.natgeofe.com/n/17f49395-6338-417e-80a6-142f24c62ea8/MM8119_121001_18918.jpg?w=636&h=424
Staff Sgt. Thomas Sager carrying the body of a dog killed on patrol in Kandahar, 0, https://i.natgeofe.com/n/f941cb39-3f8b-41f5-b4f3-35ce77456e75/MM8119_120930_17754.jpg?w=636&h=424
This photo was submitted to Your Shot, our photo community on Instagram. Follow us on Instagram at @natgeoyourshot or visit us at natgeo.com/yourshot for the latest submissions and news about the community., 1, https://i.natgeofe.com/n/4456705b-97fc-4350-af72-7728dfd68f39/6987763.jpg?w=636&h=422
a black lab comforting a mother who lost her son in Afghanistan, 1, https://i.natgeofe.com/n/0a84bdd4-3907-4aac-b7cc-2c58649f50ed/MM8119_130427_41877.jpg?w=1024&h=683
a retired military detection dog with his new family in Texas, 1, https://i.natgeofe.com/n/b044c014-89af-44ee-aa5d-4e1febb3282d/MM8119_120523_14237.jpg?w=1024&h=683
A London crowd gathers to see off Maj. Edwin Richardson, a World War I pioneer in war-dog training. His bloodhounds helped locate wounded soldiers and later carried messages between outposts during artillery bombardments., 1, https://i.natgeofe.com/n/4eb1acdb-2f4e-4036-9d3c-27f6d45c9ded/3264531.jpg?w=636&h=462
German troops take cover with a dog during World War I. The first organized military war-dog school was established in Germany in 1884., 1, https://i.natgeofe.com/n/4de0e694-5100-449c-93c1-6cc73a19d736/HU037200.jpg?w=636&h=495
A French sergeant and his dog wear gas masks on the front lines in World War I. On the horizon, a wounded man is carried on a stretcher. With their sensitive noses, dogs were able to smell gas attacks and bark a warning before troops could detect the chemicals., 1, https://i.natgeofe.com/n/5e0b4fb5-6874-4526-8e20-298ba573f839/NationalGeographic_131948.jpg?w=636&h=874
Soldiers present dogs for induction into the U.S. Army in 1942 in Front Royal, Virginia. After Pearl Harbor, Americans were encouraged to donate their dogs to the Army. Dogs sent from all 48 states were trained for patrol, sentry duty, mine detection, and as messengers., 1, https://i.natgeofe.com/n/4058500f-ba9b-4396-8ef9-a6bc0989c255/BE023027.jpg?w=636&h=517
U.S. GIs in World War II treat a combat dog wounded in the battle for Guam., 1, https://i.natgeofe.com/n/e4230d25-14ba-4f68-9fbe-5a77d4ee4a9f/50624347.jpg?w=636&h=652
U.S. Marines and a combat dog run toward a helicopter in Tay Ninh, Vietnam, in 1968. Military dogs in Vietnam led jungle patrols and sniffed out weapons caches, among other duties. Despite protests from their handlers, at war’s end the military left some 4,000 dogs behind., 1, https://i.natgeofe.com/n/546d3273-bc2b-4369-818a-17f73c27761d/2665340.jpg?w=636&h=409
This photo was submitted to Your Shot, our photo community on Instagram. Follow us on Instagram at @natgeoyourshot or visit us at natgeo.com/yourshot for the latest submissions and news about the community., 1, https://i.natgeofe.com/n/d357734c-51c4-48b6-ae3a-14dab1b2ba58/7026365.jpg?w=636&h=424
dog carrying a piece of ivory, 1, https://i.natgeofe.com/n/2900f1a9-95b0-4837-9df9-5029ecbeaf32/01-Dogs-Sniff-Out-Ivory-in-Kenya.jpg?w=374&h=249
an English Springer Spaniel sniffer dog at the Nairobi airport, 1, https://i.natgeofe.com/n/c1425d00-9111-4936-9d53-4eed153e01ab/02-Dogs-Sniff-Out-Ivory-in-Kenya.jpg?w=636&h=426
skydiving with dog, 0, https://i.natgeofe.com/n/87bd6466-cf1f-4574-b9ce-0673199514e8/01_skydiving_dogs.jpg?w=374&h=249
a diabetes detection dog with owner, 1, https://i.natgeofe.com/n/ce12264b-eeea-47a3-978f-09975d611041/02diabetesdog.jpg?w=374&h=236
a diabetes detection dog, 1, https://i.natgeofe.com/n/cedfd93f-08ac-4db9-a4ba-126ef114bb2c/01diabetesdog.jpg?w=636&h=424
