description, isdog
"Queime a Gordura Abdominal Com Uma Goma Por Dia. Experimente Agora", 0
"colorful structure looking like a tree.", 0
"How these 1930s maps left some neighborhoods with fewer trees", 0
"Why a whale's world is a world of sound", 0
"Behind the Scenes of Our January 2021 Special Issue, ‘2020: The Year in Pictures’", 0
"The Making of a Photograph: Commitment March", 0
"Tales of the Giant", 1
"Discover how conservationists are reintroducing extinct wildlife in Iberá National Park", 0
"Isso é O Que Os Implantes Dentários De Boca Cheia Devem Custar Em 2023", 0
"embryo on dark blue backgraund", 0
"green fluorescence dots on black background.", 0
"skull on foreground and full human skeleton on background.", 0
"man holding photograph of capsule.", 0
"human brain on black background.", 0
"woman in white coat with image of a human embryo projected on her and wall.", 0
"blue, green and pink blob.", 0
"pregnant woman and projected image of human fetus.", 0
"human lungs preserved in clear glass container.", 0
"Top 50 Amazing Beaches in the World", 0
"bat specimen.", 0
"pangolin specimen.", 0
"complex inner workings of an electron microscope.", 0
"tall stand with computer monitor with viruses images on it.", 0
"colorful structure looking like a tree.", 0
"three greyhounds racing", 1
"the front of Derby Lane", 0
"a group of greyhounds dispersed in a closure with sand", 1
"The World’s Leading Aircraft Are Painted in an Incredible Way", 0
"a tub filled with meat and rice", 0
"a man rubbing the hind legs of a greyhound", 1
"the profile of a greyhound", 1
"<p>In 1950, thousands of fans would gather at Derby Lane to watch the races from the grandstands.</p>", 0
"<p>Uniformed monkeys ride greyhounds around a track in Culver City, California, in 1932.</p>", 0
"<p>Throughout the 1920s and 1930s, a number of tracks had monkey “jockeys.”</p>", 1
"<p>R.L. “Tex” Block, an owner and trainer, stands in front of the Derby Club in 1970 with seven of his dogs. </p>
", 0
"<p>Kitty Wilkerson, the 1969 Festival of States “sungoddess,” stands with L.B.’s Dallas, the winner of the festival’s all-ages championship race.</p>", 1
"<p>Owner and trainer Jeanette Eagan ran dogs at Derby Lane from 1925 to 1980. She’s pictured here with Eagan’s Stephen, Eagen’s Maestro, and Rum Dum.</p>", 1
"a woman sitting with her dog on his bed", 1
"a dog in a sunroom", 1
"a computer screen showing the race finishing line", 0
"a man holding two greyhound medals in his hands", 0
"a magnifying glass over an old black and white photograph of a greyhound", 1
"a baby being placed onto of a greyhound on the beach", 1
"a group of greyhound playing in the ocean water", 1
"Actors Patrick Fugit and Kate Hudson in a scene from 'Almost Famous.'", 0
"three greyhounds racing", 1
"the front of Derby Lane", 0
"a group of greyhounds dispersed in a closure with sand", 1
"a tub filled with meat and rice", 0
"a man rubbing the hind legs of a greyhound", 1
"the profile of a greyhound", 1
"<p>In 1950, thousands of fans would gather at Derby Lane to watch the races from the grandstands.</p>", 0
"<p>Uniformed monkeys ride greyhounds around a track in Culver City, California, in 1932.</p>", 0
"<p>Throughout the 1920s and 1930s, a number of tracks had monkey “jockeys.”</p>", 1
"<p>R.L. “Tex” Block, an owner and trainer, stands in front of the Derby Club in 1970 with seven of his dogs. </p>
", 0
"Actor Sean Astin as the title character of the college football movie 'Rudy.'", 0
"<p>Kitty Wilkerson, the 1969 Festival of States “sungoddess,” stands with L.B.’s Dallas, the winner of the festival’s all-ages championship race.</p>", 1
"<p>Owner and trainer Jeanette Eagan ran dogs at Derby Lane from 1925 to 1980. She’s pictured here with Eagan’s Stephen, Eagen’s Maestro, and Rum Dum.</p>", 1
"a woman sitting with her dog on his bed", 1
"a dog in a sunroom", 1
"a computer screen showing the race finishing line", 0
"a man holding two greyhound medals in his hands", 0
"a magnifying glass over an old black and white photograph of a greyhound", 1
"a baby being placed onto of a greyhound on the beach", 1
"a group of greyhound playing in the ocean water", 1
"Actors Mariska Hargitay and Christopher Meloni filming on location for 'Law & Order: SVU' on the streets of Manhattan on Feb. 14, 2011 in New York City.", 0
"old painting depicting man in armor and naked woman.", 0
"longleged creature working over river and shooting guns.", 0
"planet surface marked with lines and names.", 0
"movie poster with insect-like creature flyings toward Earth.", 0
"tall preacher shaking hands with human.", 0
"movie poster.", 0
"blurry photo in reddish color with dark spots.", 0
"b&W blurry photo of planet surface.", 0
"painting of vegetation on Mars.", 0
