description, isdog, url
This photo was submitted to Your Shot, our photo community on Instagram. Follow us on Instagram at @natgeoyourshot or visit us at natgeo.com/yourshot for the latest submissions and news about the community.,1,This photo was submitted to Your Shot, our photo community on Instagram. Follow us on Instagram at @natgeoyourshot or visit us at natgeo.com/yourshot for the latest submissions and news about the community.
<p>This coyote was seen on several occasions hunting meadow voles in Yellowstone National Park—quite successfully.</p>
,1,<p>This coyote was seen on several occasions hunting meadow voles in Yellowstone National Park—quite successfully.</p>

A hiker looks across the mountainous landscape of High Scardus trail, where long strands of golden grass blanket the terrain.,0,A hiker looks across the mountainous landscape of High Scardus trail, where long strands of golden grass blanket the terrain.
The Church of St. John at Kaneo stands on the shore of Lake Ohrid in North Macedonia.,0,The Church of St. John at Kaneo stands on the shore of Lake Ohrid in North Macedonia.
A man leans over to place a log into the wood burning stove of a small mountain hut.,0,A man leans over to place a log into the wood burning stove of a small mountain hut.
A shepherd stands by the doorway of his home, dressed in yellow rain gear.,0,A shepherd stands by the doorway of his home, dressed in yellow rain gear.
A hiker is seen walking through a path of green and red foliage that's nearly as tall as the hiker.,0,A hiker is seen walking through a path of green and red foliage that's nearly as tall as the hiker.
<p>African wild dogs play.</p>
,1,<p>African wild dogs play.</p>

Ring-tailed lemur in a forest in Ifotaka.,1,Ring-tailed lemur in a forest in Ifotaka.
